{"$schema":"http://json-schema.org/draft-07/schema#","$id":"report.v1","title":"PipelineReport","type":"object","required":["schema_version","canonical_flow","generated_at","ingestion","analysis","resolution","evaluation_report_checksum","proposal","audit"],"properties":{"schema_version":{"type":"string","const":"report.v1"},"canonical_flow":{"type":"string","const":"/pipeline/shadow/run"},"generated_at":{"type":"string"},"app_version":{"type":"string"},"ingestion":{"type":"object"},"analysis":{"type":"object"},"resolution":{"type":"object"},"evaluation_report_checksum":{"type":["string","null"]},"proposal":{"type":"object"},"audit":{"type":"object"},"activation":{"type":"object"},"error":{"type":"string"},"detail":{"type":"string"},"dry_run":{"type":"boolean"}},"additionalProperties":true}
