{"schema_version":"report.v1","canonical_flow":"/pipeline/shadow/run","generated_at":"2025-06-01T12:00:00+00:00","app_version":"0.0.0","ingestion":{"payload_checksum":"abc123","collected_at":"2025-06-01T12:00:00+00:00"},"analysis":{"snapshot_id":1,"markets_picks_confidences":{},"decisions":[]},"resolution":{"market_outcomes":{}},"evaluation_report_checksum":"def456","proposal":{"diffs":[],"guardrails_results":[],"proposal_checksum":"ghi789"},"audit":{"changed_count":0,"per_market_change_count":{},"snapshots_checksum":"","current_policy_checksum":"","proposed_policy_checksum":""}}
